{
  "$schema": "https://json-schema.org/draft/2020-12/schema",
  "$id": "https://schemas.stravica.io/rcf/v0.6.0/test-suite.schema.json",
  "title": "RCF Test Suite",
  "description": "One file per Test Suite. Verifies one or more Acceptance Criteria (on the User Story identified by usId) via inline Test Cases. Test Suites hold the AC references; ACs stay clean of downstream references. Test-run status per TC is authored (Phase 3.7) and later derived from real test runs (Phase 6+). From 0.5.0 `testPointer` is conditionally required on each Test Case: required when the TC status is `passing` or `failing` (a passing or failing verdict must point at the executable test that produced it), optional when the TC status is `pending` or `skipped` (no executable test has landed yet, and there is nothing honest to point at).",
  "type": "object",
  "additionalProperties": false,
  "required": [
    "id",
    "usId",
    "title",
    "purpose",
    "testLevel",
    "acIds",
    "testCases",
    "status",
    "createdAt",
    "updatedAt"
  ],
  "properties": {
    "id": { "$ref": "https://schemas.stravica.io/rcf/v0.6.0/common.schema.json#/$defs/tsId" },
    "usId": { "$ref": "https://schemas.stravica.io/rcf/v0.6.0/common.schema.json#/$defs/usId" },
    "title": { "type": "string", "minLength": 1 },
    "purpose": { "type": "string", "minLength": 1 },
    "testLevel": { "enum": ["unit", "integration", "e2e", "contract", "manual"] },
    "acIds": {
      "type": "array",
      "minItems": 1,
      "items": { "$ref": "https://schemas.stravica.io/rcf/v0.6.0/common.schema.json#/$defs/acId" }
    },
    "testCases": {
      "type": "array",
      "minItems": 0,
      "items": { "$ref": "#/$defs/testCase" }
    },
    "status": { "$ref": "https://schemas.stravica.io/rcf/v0.6.0/common.schema.json#/$defs/authoringStatus" },
    "createdAt": { "$ref": "https://schemas.stravica.io/rcf/v0.6.0/common.schema.json#/$defs/timestamp" },
    "updatedAt": { "$ref": "https://schemas.stravica.io/rcf/v0.6.0/common.schema.json#/$defs/timestamp" }
  },
  "$defs": {
    "testCase": {
      "type": "object",
      "additionalProperties": false,
      "required": ["id", "acId", "description", "status"],
      "properties": {
        "id": {
          "type": "string",
          "pattern": "^TC-\\d{3,}-[a-z0-9-]+$",
          "description": "Test Case identifier. TS suffix (three-digit minimum, unbounded above) joined to a lowercase alphanumeric slug (hyphens allowed)."
        },
        "acId": { "$ref": "https://schemas.stravica.io/rcf/v0.6.0/common.schema.json#/$defs/acId" },
        "description": { "type": "string", "minLength": 1 },
        "testPointer": {
          "type": "string",
          "minLength": 1,
          "description": "Pointer to the executable test, format: filePath::testName. Required when `status` is `passing` or `failing` (a passing or failing verdict claims coverage and must point at the test that produced the verdict); optional when `status` is `pending` or `skipped` (no executable test has landed yet)."
        },
        "status": { "enum": ["pending", "passing", "failing", "skipped"] },
        "scope": {
          "$ref": "https://schemas.stravica.io/rcf/v0.6.0/common.schema.json#/$defs/scopeTag",
          "description": "Scope this test case exercises (library, runtime, deployed, unclassified). Optional at schema level; ruleset-enforcing consumers may require the TC scope to be equal to or wider than the covered AC's scope."
        },
        "runtimeProvenance": { "$ref": "#/$defs/runtimeProvenance" }
      },
      "allOf": [
        {
          "if": {
            "required": ["status"],
            "properties": {
              "status": { "enum": ["passing", "failing"] }
            }
          },
          "then": {
            "properties": {
              "testPointer": { "type": "string", "minLength": 1 }
            },
            "required": ["testPointer"]
          }
        }
      ]
    },
    "runtimeProvenance": {
      "type": "object",
      "additionalProperties": false,
      "properties": {
        "profile": {
          "enum": ["mock", "stub", "fixture", "live", "mixed"],
          "description": "Runtime execution profile the test case actually addressed. mock: the boundary is replaced entirely, no outbound traffic. stub: a stand-in the test controls, localhost only. fixture: replayed responses (cassette or MSW). live: the real third-party service or its provider sandbox. mixed: multiple probes with different profiles; anti-pattern flag pending expansion into finer TCs."
        },
        "envVarsRequired": {
          "type": "array",
          "items": { "type": "string" },
          "description": "Environment variable names the test genuinely reads at runtime. Empty array means the test does not read env."
        },
        "externalHostsReached": {
          "type": "array",
          "items": { "type": "string" },
          "description": "Hostnames the test actually reached over the wire. Empty for mock, stub, and fixture profiles. Never contains a URL with credentials."
        },
        "notes": {
          "type": "string",
          "description": "One-line free text describing the test's runtime shape. Never contains a token, key, or password."
        }
      },
      "description": "Per-test-case record of the runtime the test addressed. Optional at schema level; enforced at build-side coverage-strict when the covering AC binds a service attestation."
    }
  }
}
